No.     Time           Source                Destination           Protocol Length Info
      1 0.000000       192.168.1.4           217.12.11.66          TCP      62     1470 → 587 [SYN] Seq=0 Win=65535 Len=0 MSS=1460 SACK_PERM=1

Frame 1: 62 bytes on wire (496 bits), 62 bytes captured (496 bits)
Ethernet II, Src: SonyCorp_db:60:8f (08:00:46:db:60:8f), Dst: Netgear_03:9e:c2 (00:1b:2f:03:9e:c2)
Internet Protocol Version 4, Src: 192.168.1.4, Dst: 217.12.11.66
Transmission Control Protocol, Src Port: 1470 (1470), Dst Port: 587 (587), Seq: 0, Len: 0

No.     Time           Source                Destination           Protocol Length Info
      2 0.019166       217.12.11.66          192.168.1.4           TCP      60     587 → 1470 [SYN, ACK] Seq=0 Ack=1 Win=65535 Len=0 MSS=1460

Frame 2: 60 bytes on wire (480 bits), 60 bytes captured (480 bits)
Ethernet II, Src: Netgear_03:9e:c2 (00:1b:2f:03:9e:c2), Dst: SonyCorp_db:60:8f (08:00:46:db:60:8f)
Internet Protocol Version 4, Src: 217.12.11.66, Dst: 192.168.1.4
Transmission Control Protocol, Src Port: 587 (587), Dst Port: 1470 (1470), Seq: 0, Ack: 1, Len: 0

No.     Time           Source                Destination           Protocol Length Info
      3 0.019218       192.168.1.4           217.12.11.66          TCP      54     1470 → 587 [ACK] Seq=1 Ack=1 Win=65535 Len=0

Frame 3: 54 bytes on wire (432 bits), 54 bytes captured (432 bits)
Ethernet II, Src: SonyCorp_db:60:8f (08:00:46:db:60:8f), Dst: Netgear_03:9e:c2 (00:1b:2f:03:9e:c2)
Internet Protocol Version 4, Src: 192.168.1.4, Dst: 217.12.11.66
Transmission Control Protocol, Src Port: 1470 (1470), Dst Port: 587 (587), Seq: 1, Ack: 1, Len: 0

No.     Time           Source                Destination           Protocol Length Info
      4 0.046371       217.12.11.66          192.168.1.4           SMTP     92     S: 220 smtp006.mail.xxx.xxxxx.com ESMTP

Frame 4: 92 bytes on wire (736 bits), 92 bytes captured (736 bits)
Ethernet II, Src: Netgear_03:9e:c2 (00:1b:2f:03:9e:c2), Dst: SonyCorp_db:60:8f (08:00:46:db:60:8f)
Internet Protocol Version 4, Src: 217.12.11.66, Dst: 192.168.1.4
Transmission Control Protocol, Src Port: 587 (587), Dst Port: 1470 (1470), Seq: 1, Ack: 1, Len: 38
Simple Mail Transfer Protocol

No.     Time           Source                Destination           Protocol Length Info
      5 0.046493       192.168.1.4           217.12.11.66          SMTP     69     C: EHLO Percival

Frame 5: 69 bytes on wire (552 bits), 69 bytes captured (552 bits)
Ethernet II, Src: SonyCorp_db:60:8f (08:00:46:db:60:8f), Dst: Netgear_03:9e:c2 (00:1b:2f:03:9e:c2)
Internet Protocol Version 4, Src: 192.168.1.4, Dst: 217.12.11.66
Transmission Control Protocol, Src Port: 1470 (1470), Dst Port: 587 (587), Seq: 1, Ack: 39, Len: 15
Simple Mail Transfer Protocol

No.     Time           Source                Destination           Protocol Length Info
      6 0.063036       217.12.11.66          192.168.1.4           SMTP     148    S: 250 smtp006.mail.xxx.xxxxx.com | 250 AUTH LOGIN PLAIN XYMCOOKIE | 250 PIPELINING | 250 8BITMIME

Frame 6: 148 bytes on wire (1184 bits), 148 bytes captured (1184 bits)
Ethernet II, Src: Netgear_03:9e:c2 (00:1b:2f:03:9e:c2), Dst: SonyCorp_db:60:8f (08:00:46:db:60:8f)
Internet Protocol Version 4, Src: 217.12.11.66, Dst: 192.168.1.4
Transmission Control Protocol, Src Port: 587 (587), Dst Port: 1470 (1470), Seq: 39, Ack: 16, Len: 94
Simple Mail Transfer Protocol

No.     Time           Source                Destination           Protocol Length Info
      7 0.063230       192.168.1.4           217.12.11.66          SMTP     66     C: AUTH LOGIN

Frame 7: 66 bytes on wire (528 bits), 66 bytes captured (528 bits)
Ethernet II, Src: SonyCorp_db:60:8f (08:00:46:db:60:8f), Dst: Netgear_03:9e:c2 (00:1b:2f:03:9e:c2)
Internet Protocol Version 4, Src: 192.168.1.4, Dst: 217.12.11.66
Transmission Control Protocol, Src Port: 1470 (1470), Dst Port: 587 (587), Seq: 16, Ack: 133, Len: 12
Simple Mail Transfer Protocol

No.     Time           Source                Destination           Protocol Length Info
      8 0.080834       217.12.11.66          192.168.1.4           SMTP     72     S: 334 VXNlcm5hbWU6

Frame 8: 72 bytes on wire (576 bits), 72 bytes captured (576 bits)
Ethernet II, Src: Netgear_03:9e:c2 (00:1b:2f:03:9e:c2), Dst: SonyCorp_db:60:8f (08:00:46:db:60:8f)
Internet Protocol Version 4, Src: 217.12.11.66, Dst: 192.168.1.4
Transmission Control Protocol, Src Port: 587 (587), Dst Port: 1470 (1470), Seq: 133, Ack: 28, Len: 18
Simple Mail Transfer Protocol

No.     Time           Source                Destination           Protocol Length Info
      9 0.080933       192.168.1.4           217.12.11.66          SMTP     64     C: User: Z2FsdW50

Frame 9: 64 bytes on wire (512 bits), 64 bytes captured (512 bits)
Ethernet II, Src: SonyCorp_db:60:8f (08:00:46:db:60:8f), Dst: Netgear_03:9e:c2 (00:1b:2f:03:9e:c2)
Internet Protocol Version 4, Src: 192.168.1.4, Dst: 217.12.11.66
Transmission Control Protocol, Src Port: 1470 (1470), Dst Port: 587 (587), Seq: 28, Ack: 151, Len: 10
Simple Mail Transfer Protocol

No.     Time           Source                Destination           Protocol Length Info
     10 0.098710       217.12.11.66          192.168.1.4           SMTP     72     S: 334 UGFzc3dvcmQ6

Frame 10: 72 bytes on wire (576 bits), 72 bytes captured (576 bits)
Ethernet II, Src: Netgear_03:9e:c2 (00:1b:2f:03:9e:c2), Dst: SonyCorp_db:60:8f (08:00:46:db:60:8f)
Internet Protocol Version 4, Src: 217.12.11.66, Dst: 192.168.1.4
Transmission Control Protocol, Src Port: 587 (587), Dst Port: 1470 (1470), Seq: 151, Ack: 38, Len: 18
Simple Mail Transfer Protocol

No.     Time           Source                Destination           Protocol Length Info
     11 0.098824       192.168.1.4           217.12.11.66          SMTP     68     C: Pass: VjF2MXRyMG4=

Frame 11: 68 bytes on wire (544 bits), 68 bytes captured (544 bits)
Ethernet II, Src: SonyCorp_db:60:8f (08:00:46:db:60:8f), Dst: Netgear_03:9e:c2 (00:1b:2f:03:9e:c2)
Internet Protocol Version 4, Src: 192.168.1.4, Dst: 217.12.11.66
Transmission Control Protocol, Src Port: 1470 (1470), Dst Port: 587 (587), Seq: 38, Ack: 169, Len: 14
Simple Mail Transfer Protocol

No.     Time           Source                Destination           Protocol Length Info
     12 0.209057       217.12.11.66          192.168.1.4           TCP      60     587 → 1470 [ACK] Seq=169 Ack=52 Win=65535 Len=0

Frame 12: 60 bytes on wire (480 bits), 60 bytes captured (480 bits)
Ethernet II, Src: Netgear_03:9e:c2 (00:1b:2f:03:9e:c2), Dst: SonyCorp_db:60:8f (08:00:46:db:60:8f)
Internet Protocol Version 4, Src: 217.12.11.66, Dst: 192.168.1.4
Transmission Control Protocol, Src Port: 587 (587), Dst Port: 1470 (1470), Seq: 169, Ack: 52, Len: 0

No.     Time           Source                Destination           Protocol Length Info
     13 0.278370       217.12.11.66          192.168.1.4           SMTP     81     S: 235 ok, go ahead (#2.0.0)

Frame 13: 81 bytes on wire (648 bits), 81 bytes captured (648 bits)
Ethernet II, Src: Netgear_03:9e:c2 (00:1b:2f:03:9e:c2), Dst: SonyCorp_db:60:8f (08:00:46:db:60:8f)
Internet Protocol Version 4, Src: 217.12.11.66, Dst: 192.168.1.4
Transmission Control Protocol, Src Port: 587 (587), Dst Port: 1470 (1470), Seq: 169, Ack: 52, Len: 27
Simple Mail Transfer Protocol

No.     Time           Source                Destination           Protocol Length Info
     14 0.278598       192.168.1.4           217.12.11.66          SMTP     87     C: MAIL FROM: <xxxxxx@xxxxx.co.uk>

Frame 14: 87 bytes on wire (696 bits), 87 bytes captured (696 bits)
Ethernet II, Src: SonyCorp_db:60:8f (08:00:46:db:60:8f), Dst: Netgear_03:9e:c2 (00:1b:2f:03:9e:c2)
Internet Protocol Version 4, Src: 192.168.1.4, Dst: 217.12.11.66
Transmission Control Protocol, Src Port: 1470 (1470), Dst Port: 587 (587), Seq: 52, Ack: 196, Len: 33
Simple Mail Transfer Protocol

No.     Time           Source                Destination           Protocol Length Info
     15 0.297521       217.12.11.66          192.168.1.4           SMTP     62     S: 250 ok

Frame 15: 62 bytes on wire (496 bits), 62 bytes captured (496 bits)
Ethernet II, Src: Netgear_03:9e:c2 (00:1b:2f:03:9e:c2), Dst: SonyCorp_db:60:8f (08:00:46:db:60:8f)
Internet Protocol Version 4, Src: 217.12.11.66, Dst: 192.168.1.4
Transmission Control Protocol, Src Port: 587 (587), Dst Port: 1470 (1470), Seq: 196, Ack: 85, Len: 8
Simple Mail Transfer Protocol

No.     Time           Source                Destination           Protocol Length Info
     16 0.297628       192.168.1.4           217.12.11.66          SMTP     88     C: RCPT TO: <xxxxxx.xxxx@xxxxx.com>

Frame 16: 88 bytes on wire (704 bits), 88 bytes captured (704 bits)
Ethernet II, Src: SonyCorp_db:60:8f (08:00:46:db:60:8f), Dst: Netgear_03:9e:c2 (00:1b:2f:03:9e:c2)
Internet Protocol Version 4, Src: 192.168.1.4, Dst: 217.12.11.66
Transmission Control Protocol, Src Port: 1470 (1470), Dst Port: 587 (587), Seq: 85, Ack: 204, Len: 34
Simple Mail Transfer Protocol

No.     Time           Source                Destination           Protocol Length Info
     17 0.315767       217.12.11.66          192.168.1.4           SMTP     62     S: 250 ok

Frame 17: 62 bytes on wire (496 bits), 62 bytes captured (496 bits)
Ethernet II, Src: Netgear_03:9e:c2 (00:1b:2f:03:9e:c2), Dst: SonyCorp_db:60:8f (08:00:46:db:60:8f)
Internet Protocol Version 4, Src: 217.12.11.66, Dst: 192.168.1.4
Transmission Control Protocol, Src Port: 587 (587), Dst Port: 1470 (1470), Seq: 204, Ack: 119, Len: 8
Simple Mail Transfer Protocol

No.     Time           Source                Destination           Protocol Length Info
     18 0.315877       192.168.1.4           217.12.11.66          SMTP     60     C: DATA

Frame 18: 60 bytes on wire (480 bits), 60 bytes captured (480 bits)
Ethernet II, Src: SonyCorp_db:60:8f (08:00:46:db:60:8f), Dst: Netgear_03:9e:c2 (00:1b:2f:03:9e:c2)
Internet Protocol Version 4, Src: 192.168.1.4, Dst: 217.12.11.66
Transmission Control Protocol, Src Port: 1470 (1470), Dst Port: 587 (587), Seq: 119, Ack: 212, Len: 6
Simple Mail Transfer Protocol

No.     Time           Source                Destination           Protocol Length Info
     19 0.346362       217.12.11.66          192.168.1.4           SMTP     68     S: 354 go ahead

Frame 19: 68 bytes on wire (544 bits), 68 bytes captured (544 bits)
Ethernet II, Src: Netgear_03:9e:c2 (00:1b:2f:03:9e:c2), Dst: SonyCorp_db:60:8f (08:00:46:db:60:8f)
Internet Protocol Version 4, Src: 217.12.11.66, Dst: 192.168.1.4
Transmission Control Protocol, Src Port: 587 (587), Dst Port: 1470 (1470), Seq: 212, Ack: 125, Len: 14
Simple Mail Transfer Protocol

No.     Time           Source                Destination           Protocol Length Info
     20 0.352348       192.168.1.4           217.12.11.66          SMTP     1514   C: DATA fragment, 1460 bytes

Frame 20: 1514 bytes on wire (12112 bits), 1514 bytes captured (12112 bits)
Ethernet II, Src: SonyCorp_db:60:8f (08:00:46:db:60:8f), Dst: Netgear_03:9e:c2 (00:1b:2f:03:9e:c2)
Internet Protocol Version 4, Src: 192.168.1.4, Dst: 217.12.11.66
Transmission Control Protocol, Src Port: 1470 (1470), Dst Port: 587 (587), Seq: 125, Ack: 226, Len: 1460
Simple Mail Transfer Protocol

No.     Time           Source                Destination           Protocol Length Info
     21 0.352379       192.168.1.4           217.12.11.66          SMTP     1514   C: DATA fragment, 1460 bytes

Frame 21: 1514 bytes on wire (12112 bits), 1514 bytes captured (12112 bits)
Ethernet II, Src: SonyCorp_db:60:8f (08:00:46:db:60:8f), Dst: Netgear_03:9e:c2 (00:1b:2f:03:9e:c2)
Internet Protocol Version 4, Src: 192.168.1.4, Dst: 217.12.11.66
Transmission Control Protocol, Src Port: 1470 (1470), Dst Port: 587 (587), Seq: 1585, Ack: 226, Len: 1460
Simple Mail Transfer Protocol

No.     Time           Source                Destination           Protocol Length Info
     22 0.352397       192.168.1.4           217.12.11.66          SMTP     1514   C: DATA fragment, 1460 bytes

Frame 22: 1514 bytes on wire (12112 bits), 1514 bytes captured (12112 bits)
Ethernet II, Src: SonyCorp_db:60:8f (08:00:46:db:60:8f), Dst: Netgear_03:9e:c2 (00:1b:2f:03:9e:c2)
Internet Protocol Version 4, Src: 192.168.1.4, Dst: 217.12.11.66
Transmission Control Protocol, Src Port: 1470 (1470), Dst Port: 587 (587), Seq: 3045, Ack: 226, Len: 1460
Simple Mail Transfer Protocol

No.     Time           Source                Destination           Protocol Length Info
     23 0.352413       192.168.1.4           217.12.11.66          SMTP     1514   C: DATA fragment, 1460 bytes

Frame 23: 1514 bytes on wire (12112 bits), 1514 bytes captured (12112 bits)
Ethernet II, Src: SonyCorp_db:60:8f (08:00:46:db:60:8f), Dst: Netgear_03:9e:c2 (00:1b:2f:03:9e:c2)
Internet Protocol Version 4, Src: 192.168.1.4, Dst: 217.12.11.66
Transmission Control Protocol, Src Port: 1470 (1470), Dst Port: 587 (587), Seq: 4505, Ack: 226, Len: 1460
Simple Mail Transfer Protocol

No.     Time           Source                Destination           Protocol Length Info
     24 0.352429       192.168.1.4           217.12.11.66          SMTP     1514   C: DATA fragment, 1460 bytes

Frame 24: 1514 bytes on wire (12112 bits), 1514 bytes captured (12112 bits)
Ethernet II, Src: SonyCorp_db:60:8f (08:00:46:db:60:8f), Dst: Netgear_03:9e:c2 (00:1b:2f:03:9e:c2)
Internet Protocol Version 4, Src: 192.168.1.4, Dst: 217.12.11.66
Transmission Control Protocol, Src Port: 1470 (1470), Dst Port: 587 (587), Seq: 5965, Ack: 226, Len: 1460
Simple Mail Transfer Protocol

No.     Time           Source                Destination           Protocol Length Info
     25 0.352446       192.168.1.4           217.12.11.66          SMTP     946    C: DATA fragment, 892 bytes

Frame 25: 946 bytes on wire (7568 bits), 946 bytes captured (7568 bits)
Ethernet II, Src: SonyCorp_db:60:8f (08:00:46:db:60:8f), Dst: Netgear_03:9e:c2 (00:1b:2f:03:9e:c2)
Internet Protocol Version 4, Src: 192.168.1.4, Dst: 217.12.11.66
Transmission Control Protocol, Src Port: 1470 (1470), Dst Port: 587 (587), Seq: 7425, Ack: 226, Len: 892
Simple Mail Transfer Protocol

No.     Time           Source                Destination           Protocol Length Info
     26 0.384371       217.12.11.66          192.168.1.4           TCP      60     587 → 1470 [ACK] Seq=226 Ack=3045 Win=64240 Len=0

Frame 26: 60 bytes on wire (480 bits), 60 bytes captured (480 bits)
Ethernet II, Src: Netgear_03:9e:c2 (00:1b:2f:03:9e:c2), Dst: SonyCorp_db:60:8f (08:00:46:db:60:8f)
Internet Protocol Version 4, Src: 217.12.11.66, Dst: 192.168.1.4
Transmission Control Protocol, Src Port: 587 (587), Dst Port: 1470 (1470), Seq: 226, Ack: 3045, Len: 0

No.     Time           Source                Destination           Protocol Length Info
     27 0.428853       217.12.11.66          192.168.1.4           TCP      60     587 → 1470 [ACK] Seq=226 Ack=5965 Win=64240 Len=0

Frame 27: 60 bytes on wire (480 bits), 60 bytes captured (480 bits)
Ethernet II, Src: Netgear_03:9e:c2 (00:1b:2f:03:9e:c2), Dst: SonyCorp_db:60:8f (08:00:46:db:60:8f)
Internet Protocol Version 4, Src: 217.12.11.66, Dst: 192.168.1.4
Transmission Control Protocol, Src Port: 587 (587), Dst Port: 1470 (1470), Seq: 226, Ack: 5965, Len: 0

No.     Time           Source                Destination           Protocol Length Info
     28 0.463771       217.12.11.66          192.168.1.4           TCP      60     587 → 1470 [ACK] Seq=226 Ack=8317 Win=64808 Len=0

Frame 28: 60 bytes on wire (480 bits), 60 bytes captured (480 bits)
Ethernet II, Src: Netgear_03:9e:c2 (00:1b:2f:03:9e:c2), Dst: SonyCorp_db:60:8f (08:00:46:db:60:8f)
Internet Protocol Version 4, Src: 217.12.11.66, Dst: 192.168.1.4
Transmission Control Protocol, Src Port: 587 (587), Dst Port: 1470 (1470), Seq: 226, Ack: 8317, Len: 0

No.     Time           Source                Destination           Protocol Length Info
     29 0.463902       192.168.1.4           217.12.11.66          SMTP     1514   C: DATA fragment, 1460 bytes

Frame 29: 1514 bytes on wire (12112 bits), 1514 bytes captured (12112 bits)
Ethernet II, Src: SonyCorp_db:60:8f (08:00:46:db:60:8f), Dst: Netgear_03:9e:c2 (00:1b:2f:03:9e:c2)
Internet Protocol Version 4, Src: 192.168.1.4, Dst: 217.12.11.66
Transmission Control Protocol, Src Port: 1470 (1470), Dst Port: 587 (587), Seq: 8317, Ack: 226, Len: 1460
Simple Mail Transfer Protocol

No.     Time           Source                Destination           Protocol Length Info
     30 0.463929       192.168.1.4           217.12.11.66          SMTP     1514   C: DATA fragment, 1460 bytes

Frame 30: 1514 bytes on wire (12112 bits), 1514 bytes captured (12112 bits)
Ethernet II, Src: SonyCorp_db:60:8f (08:00:46:db:60:8f), Dst: Netgear_03:9e:c2 (00:1b:2f:03:9e:c2)
Internet Protocol Version 4, Src: 192.168.1.4, Dst: 217.12.11.66
Transmission Control Protocol, Src Port: 1470 (1470), Dst Port: 587 (587), Seq: 9777, Ack: 226, Len: 1460
Simple Mail Transfer Protocol

No.     Time           Source                Destination           Protocol Length Info
     31 0.463946       192.168.1.4           217.12.11.66          SMTP     1514   C: DATA fragment, 1460 bytes

Frame 31: 1514 bytes on wire (12112 bits), 1514 bytes captured (12112 bits)
Ethernet II, Src: SonyCorp_db:60:8f (08:00:46:db:60:8f), Dst: Netgear_03:9e:c2 (00:1b:2f:03:9e:c2)
Internet Protocol Version 4, Src: 192.168.1.4, Dst: 217.12.11.66
Transmission Control Protocol, Src Port: 1470 (1470), Dst Port: 587 (587), Seq: 11237, Ack: 226, Len: 1460
Simple Mail Transfer Protocol

No.     Time           Source                Destination           Protocol Length Info
     32 0.463962       192.168.1.4           217.12.11.66          SMTP     1514   C: DATA fragment, 1460 bytes

Frame 32: 1514 bytes on wire (12112 bits), 1514 bytes captured (12112 bits)
Ethernet II, Src: SonyCorp_db:60:8f (08:00:46:db:60:8f), Dst: Netgear_03:9e:c2 (00:1b:2f:03:9e:c2)
Internet Protocol Version 4, Src: 192.168.1.4, Dst: 217.12.11.66
Transmission Control Protocol, Src Port: 1470 (1470), Dst Port: 587 (587), Seq: 12697, Ack: 226, Len: 1460
Simple Mail Transfer Protocol

No.     Time           Source                Destination           Protocol Length Info
     33 0.463979       192.168.1.4           217.12.11.66          SMTP     1514   C: DATA fragment, 1460 bytes

Frame 33: 1514 bytes on wire (12112 bits), 1514 bytes captured (12112 bits)
Ethernet II, Src: SonyCorp_db:60:8f (08:00:46:db:60:8f), Dst: Netgear_03:9e:c2 (00:1b:2f:03:9e:c2)
Internet Protocol Version 4, Src: 192.168.1.4, Dst: 217.12.11.66
Transmission Control Protocol, Src Port: 1470 (1470), Dst Port: 587 (587), Seq: 14157, Ack: 226, Len: 1460
Simple Mail Transfer Protocol

No.     Time           Source                Destination           Protocol Length Info
     34 0.463997       192.168.1.4           217.12.11.66          SMTP     946    C: DATA fragment, 892 bytes

Frame 34: 946 bytes on wire (7568 bits), 946 bytes captured (7568 bits)
Ethernet II, Src: SonyCorp_db:60:8f (08:00:46:db:60:8f), Dst: Netgear_03:9e:c2 (00:1b:2f:03:9e:c2)
Internet Protocol Version 4, Src: 192.168.1.4, Dst: 217.12.11.66
Transmission Control Protocol, Src Port: 1470 (1470), Dst Port: 587 (587), Seq: 15617, Ack: 226, Len: 892
Simple Mail Transfer Protocol

No.     Time           Source                Destination           Protocol Length Info
     35 0.512890       217.12.11.66          192.168.1.4           TCP      60     587 → 1470 [ACK] Seq=226 Ack=11237 Win=64240 Len=0

Frame 35: 60 bytes on wire (480 bits), 60 bytes captured (480 bits)
Ethernet II, Src: Netgear_03:9e:c2 (00:1b:2f:03:9e:c2), Dst: SonyCorp_db:60:8f (08:00:46:db:60:8f)
Internet Protocol Version 4, Src: 217.12.11.66, Dst: 192.168.1.4
Transmission Control Protocol, Src Port: 587 (587), Dst Port: 1470 (1470), Seq: 226, Ack: 11237, Len: 0

No.     Time           Source                Destination           Protocol Length Info
     36 0.557064       217.12.11.66          192.168.1.4           TCP      60     587 → 1470 [ACK] Seq=226 Ack=14157 Win=64240 Len=0

Frame 36: 60 bytes on wire (480 bits), 60 bytes captured (480 bits)
Ethernet II, Src: Netgear_03:9e:c2 (00:1b:2f:03:9e:c2), Dst: SonyCorp_db:60:8f (08:00:46:db:60:8f)
Internet Protocol Version 4, Src: 217.12.11.66, Dst: 192.168.1.4
Transmission Control Protocol, Src Port: 587 (587), Dst Port: 1470 (1470), Seq: 226, Ack: 14157, Len: 0

No.     Time           Source                Destination           Protocol Length Info
     37 0.596035       217.12.11.66          192.168.1.4           TCP      60     587 → 1470 [ACK] Seq=226 Ack=16509 Win=64808 Len=0

Frame 37: 60 bytes on wire (480 bits), 60 bytes captured (480 bits)
Ethernet II, Src: Netgear_03:9e:c2 (00:1b:2f:03:9e:c2), Dst: SonyCorp_db:60:8f (08:00:46:db:60:8f)
Internet Protocol Version 4, Src: 217.12.11.66, Dst: 192.168.1.4
Transmission Control Protocol, Src Port: 587 (587), Dst Port: 1470 (1470), Seq: 226, Ack: 16509, Len: 0

No.     Time           Source                Destination           Protocol Length Info
     38 0.596150       192.168.1.4           217.12.11.66          SMTP     1514   C: DATA fragment, 1460 bytes

Frame 38: 1514 bytes on wire (12112 bits), 1514 bytes captured (12112 bits)
Ethernet II, Src: SonyCorp_db:60:8f (08:00:46:db:60:8f), Dst: Netgear_03:9e:c2 (00:1b:2f:03:9e:c2)
Internet Protocol Version 4, Src: 192.168.1.4, Dst: 217.12.11.66
Transmission Control Protocol, Src Port: 1470 (1470), Dst Port: 587 (587), Seq: 16509, Ack: 226, Len: 1460
Simple Mail Transfer Protocol

No.     Time           Source                Destination           Protocol Length Info
     39 0.596175       192.168.1.4           217.12.11.66          SMTP     1514   C: DATA fragment, 1460 bytes

Frame 39: 1514 bytes on wire (12112 bits), 1514 bytes captured (12112 bits)
Ethernet II, Src: SonyCorp_db:60:8f (08:00:46:db:60:8f), Dst: Netgear_03:9e:c2 (00:1b:2f:03:9e:c2)
Internet Protocol Version 4, Src: 192.168.1.4, Dst: 217.12.11.66
Transmission Control Protocol, Src Port: 1470 (1470), Dst Port: 587 (587), Seq: 17969, Ack: 226, Len: 1460
Simple Mail Transfer Protocol

No.     Time           Source                Destination           Protocol Length Info
     40 0.596191       192.168.1.4           217.12.11.66          SMTP     1514   C: DATA fragment, 1460 bytes

Frame 40: 1514 bytes on wire (12112 bits), 1514 bytes captured (12112 bits)
Ethernet II, Src: SonyCorp_db:60:8f (08:00:46:db:60:8f), Dst: Netgear_03:9e:c2 (00:1b:2f:03:9e:c2)
Internet Protocol Version 4, Src: 192.168.1.4, Dst: 217.12.11.66
Transmission Control Protocol, Src Port: 1470 (1470), Dst Port: 587 (587), Seq: 19429, Ack: 226, Len: 1460
Simple Mail Transfer Protocol

No.     Time           Source                Destination           Protocol Length Info
     41 0.596207       192.168.1.4           217.12.11.66          SMTP     1514   C: DATA fragment, 1460 bytes

Frame 41: 1514 bytes on wire (12112 bits), 1514 bytes captured (12112 bits)
Ethernet II, Src: SonyCorp_db:60:8f (08:00:46:db:60:8f), Dst: Netgear_03:9e:c2 (00:1b:2f:03:9e:c2)
Internet Protocol Version 4, Src: 192.168.1.4, Dst: 217.12.11.66
Transmission Control Protocol, Src Port: 1470 (1470), Dst Port: 587 (587), Seq: 20889, Ack: 226, Len: 1460
Simple Mail Transfer Protocol

No.     Time           Source                Destination           Protocol Length Info
     42 0.596222       192.168.1.4           217.12.11.66          SMTP     1514   C: DATA fragment, 1460 bytes

Frame 42: 1514 bytes on wire (12112 bits), 1514 bytes captured (12112 bits)
Ethernet II, Src: SonyCorp_db:60:8f (08:00:46:db:60:8f), Dst: Netgear_03:9e:c2 (00:1b:2f:03:9e:c2)
Internet Protocol Version 4, Src: 192.168.1.4, Dst: 217.12.11.66
Transmission Control Protocol, Src Port: 1470 (1470), Dst Port: 587 (587), Seq: 22349, Ack: 226, Len: 1460
Simple Mail Transfer Protocol

No.     Time           Source                Destination           Protocol Length Info
     43 0.596237       192.168.1.4           217.12.11.66          SMTP     946    C: DATA fragment, 892 bytes

Frame 43: 946 bytes on wire (7568 bits), 946 bytes captured (7568 bits)
Ethernet II, Src: SonyCorp_db:60:8f (08:00:46:db:60:8f), Dst: Netgear_03:9e:c2 (00:1b:2f:03:9e:c2)
Internet Protocol Version 4, Src: 192.168.1.4, Dst: 217.12.11.66
Transmission Control Protocol, Src Port: 1470 (1470), Dst Port: 587 (587), Seq: 23809, Ack: 226, Len: 892
Simple Mail Transfer Protocol

No.     Time           Source                Destination           Protocol Length Info
     44 0.643461       217.12.11.66          192.168.1.4           TCP      60     587 → 1470 [ACK] Seq=226 Ack=19429 Win=64240 Len=0

Frame 44: 60 bytes on wire (480 bits), 60 bytes captured (480 bits)
Ethernet II, Src: Netgear_03:9e:c2 (00:1b:2f:03:9e:c2), Dst: SonyCorp_db:60:8f (08:00:46:db:60:8f)
Internet Protocol Version 4, Src: 217.12.11.66, Dst: 192.168.1.4
Transmission Control Protocol, Src Port: 587 (587), Dst Port: 1470 (1470), Seq: 226, Ack: 19429, Len: 0

No.     Time           Source                Destination           Protocol Length Info
     45 0.689082       217.12.11.66          192.168.1.4           TCP      60     587 → 1470 [ACK] Seq=226 Ack=22349 Win=64240 Len=0

Frame 45: 60 bytes on wire (480 bits), 60 bytes captured (480 bits)
Ethernet II, Src: Netgear_03:9e:c2 (00:1b:2f:03:9e:c2), Dst: SonyCorp_db:60:8f (08:00:46:db:60:8f)
Internet Protocol Version 4, Src: 217.12.11.66, Dst: 192.168.1.4
Transmission Control Protocol, Src Port: 587 (587), Dst Port: 1470 (1470), Seq: 226, Ack: 22349, Len: 0

No.     Time           Source                Destination           Protocol Length Info
     46 0.724349       217.12.11.66          192.168.1.4           TCP      60     587 → 1470 [ACK] Seq=226 Ack=24701 Win=64808 Len=0

Frame 46: 60 bytes on wire (480 bits), 60 bytes captured (480 bits)
Ethernet II, Src: Netgear_03:9e:c2 (00:1b:2f:03:9e:c2), Dst: SonyCorp_db:60:8f (08:00:46:db:60:8f)
Internet Protocol Version 4, Src: 217.12.11.66, Dst: 192.168.1.4
Transmission Control Protocol, Src Port: 587 (587), Dst Port: 1470 (1470), Seq: 226, Ack: 24701, Len: 0

No.     Time           Source                Destination           Protocol Length Info
     47 0.724485       192.168.1.4           217.12.11.66          SMTP     1514   C: DATA fragment, 1460 bytes

Frame 47: 1514 bytes on wire (12112 bits), 1514 bytes captured (12112 bits)
Ethernet II, Src: SonyCorp_db:60:8f (08:00:46:db:60:8f), Dst: Netgear_03:9e:c2 (00:1b:2f:03:9e:c2)
Internet Protocol Version 4, Src: 192.168.1.4, Dst: 217.12.11.66
Transmission Control Protocol, Src Port: 1470 (1470), Dst Port: 587 (587), Seq: 24701, Ack: 226, Len: 1460
Simple Mail Transfer Protocol

No.     Time           Source                Destination           Protocol Length Info
     48 0.724511       192.168.1.4           217.12.11.66          SMTP     1514   C: DATA fragment, 1460 bytes

Frame 48: 1514 bytes on wire (12112 bits), 1514 bytes captured (12112 bits)
Ethernet II, Src: SonyCorp_db:60:8f (08:00:46:db:60:8f), Dst: Netgear_03:9e:c2 (00:1b:2f:03:9e:c2)
Internet Protocol Version 4, Src: 192.168.1.4, Dst: 217.12.11.66
Transmission Control Protocol, Src Port: 1470 (1470), Dst Port: 587 (587), Seq: 26161, Ack: 226, Len: 1460
Simple Mail Transfer Protocol

No.     Time           Source                Destination           Protocol Length Info
     49 0.724528       192.168.1.4           217.12.11.66          SMTP     1514   C: DATA fragment, 1460 bytes

Frame 49: 1514 bytes on wire (12112 bits), 1514 bytes captured (12112 bits)
Ethernet II, Src: SonyCorp_db:60:8f (08:00:46:db:60:8f), Dst: Netgear_03:9e:c2 (00:1b:2f:03:9e:c2)
Internet Protocol Version 4, Src: 192.168.1.4, Dst: 217.12.11.66
Transmission Control Protocol, Src Port: 1470 (1470), Dst Port: 587 (587), Seq: 27621, Ack: 226, Len: 1460
Simple Mail Transfer Protocol

No.     Time           Source                Destination           Protocol Length Info
     50 0.724544       192.168.1.4           217.12.11.66          SMTP     1514   C: DATA fragment, 1460 bytes

Frame 50: 1514 bytes on wire (12112 bits), 1514 bytes captured (12112 bits)
Ethernet II, Src: SonyCorp_db:60:8f (08:00:46:db:60:8f), Dst: Netgear_03:9e:c2 (00:1b:2f:03:9e:c2)
Internet Protocol Version 4, Src: 192.168.1.4, Dst: 217.12.11.66
Transmission Control Protocol, Src Port: 1470 (1470), Dst Port: 587 (587), Seq: 29081, Ack: 226, Len: 1460
Simple Mail Transfer Protocol

No.     Time           Source                Destination           Protocol Length Info
     51 0.724560       192.168.1.4           217.12.11.66          SMTP     1514   C: DATA fragment, 1460 bytes

Frame 51: 1514 bytes on wire (12112 bits), 1514 bytes captured (12112 bits)
Ethernet II, Src: SonyCorp_db:60:8f (08:00:46:db:60:8f), Dst: Netgear_03:9e:c2 (00:1b:2f:03:9e:c2)
Internet Protocol Version 4, Src: 192.168.1.4, Dst: 217.12.11.66
Transmission Control Protocol, Src Port: 1470 (1470), Dst Port: 587 (587), Seq: 30541, Ack: 226, Len: 1460
Simple Mail Transfer Protocol

No.     Time           Source                Destination           Protocol Length Info
     52 0.724575       192.168.1.4           217.12.11.66          SMTP     946    C: DATA fragment, 892 bytes

Frame 52: 946 bytes on wire (7568 bits), 946 bytes captured (7568 bits)
Ethernet II, Src: SonyCorp_db:60:8f (08:00:46:db:60:8f), Dst: Netgear_03:9e:c2 (00:1b:2f:03:9e:c2)
Internet Protocol Version 4, Src: 192.168.1.4, Dst: 217.12.11.66
Transmission Control Protocol, Src Port: 1470 (1470), Dst Port: 587 (587), Seq: 32001, Ack: 226, Len: 892
Simple Mail Transfer Protocol

No.     Time           Source                Destination           Protocol Length Info
     53 0.774288       217.12.11.66          192.168.1.4           TCP      60     587 → 1470 [ACK] Seq=226 Ack=27621 Win=64240 Len=0

Frame 53: 60 bytes on wire (480 bits), 60 bytes captured (480 bits)
Ethernet II, Src: Netgear_03:9e:c2 (00:1b:2f:03:9e:c2), Dst: SonyCorp_db:60:8f (08:00:46:db:60:8f)
Internet Protocol Version 4, Src: 217.12.11.66, Dst: 192.168.1.4
Transmission Control Protocol, Src Port: 587 (587), Dst Port: 1470 (1470), Seq: 226, Ack: 27621, Len: 0

No.     Time           Source                Destination           Protocol Length Info
     54 0.817880       217.12.11.66          192.168.1.4           TCP      60     587 → 1470 [ACK] Seq=226 Ack=30541 Win=64240 Len=0

Frame 54: 60 bytes on wire (480 bits), 60 bytes captured (480 bits)
Ethernet II, Src: Netgear_03:9e:c2 (00:1b:2f:03:9e:c2), Dst: SonyCorp_db:60:8f (08:00:46:db:60:8f)
Internet Protocol Version 4, Src: 217.12.11.66, Dst: 192.168.1.4
Transmission Control Protocol, Src Port: 587 (587), Dst Port: 1470 (1470), Seq: 226, Ack: 30541, Len: 0

No.     Time           Source                Destination           Protocol Length Info
     55 0.856660       217.12.11.66          192.168.1.4           TCP      60     587 → 1470 [ACK] Seq=226 Ack=32893 Win=64808 Len=0

Frame 55: 60 bytes on wire (480 bits), 60 bytes captured (480 bits)
Ethernet II, Src: Netgear_03:9e:c2 (00:1b:2f:03:9e:c2), Dst: SonyCorp_db:60:8f (08:00:46:db:60:8f)
Internet Protocol Version 4, Src: 217.12.11.66, Dst: 192.168.1.4
Transmission Control Protocol, Src Port: 587 (587), Dst Port: 1470 (1470), Seq: 226, Ack: 32893, Len: 0

No.     Time           Source                Destination           Protocol Length Info
     56 0.856847       192.168.1.4           217.12.11.66          SMTP     1514   C: DATA fragment, 1460 bytes

Frame 56: 1514 bytes on wire (12112 bits), 1514 bytes captured (12112 bits)
Ethernet II, Src: SonyCorp_db:60:8f (08:00:46:db:60:8f), Dst: Netgear_03:9e:c2 (00:1b:2f:03:9e:c2)
Internet Protocol Version 4, Src: 192.168.1.4, Dst: 217.12.11.66
Transmission Control Protocol, Src Port: 1470 (1470), Dst Port: 587 (587), Seq: 32893, Ack: 226, Len: 1460
Simple Mail Transfer Protocol

No.     Time           Source                Destination           Protocol Length Info
     57 0.856874       192.168.1.4           217.12.11.66          SMTP     1514   C: DATA fragment, 1460 bytes

Frame 57: 1514 bytes on wire (12112 bits), 1514 bytes captured (12112 bits)
Ethernet II, Src: SonyCorp_db:60:8f (08:00:46:db:60:8f), Dst: Netgear_03:9e:c2 (00:1b:2f:03:9e:c2)
Internet Protocol Version 4, Src: 192.168.1.4, Dst: 217.12.11.66
Transmission Control Protocol, Src Port: 1470 (1470), Dst Port: 587 (587), Seq: 34353, Ack: 226, Len: 1460
Simple Mail Transfer Protocol

No.     Time           Source                Destination           Protocol Length Info
     58 0.856891       192.168.1.4           217.12.11.66          SMTP     1514   C: DATA fragment, 1460 bytes

Frame 58: 1514 bytes on wire (12112 bits), 1514 bytes captured (12112 bits)
Ethernet II, Src: SonyCorp_db:60:8f (08:00:46:db:60:8f), Dst: Netgear_03:9e:c2 (00:1b:2f:03:9e:c2)
Internet Protocol Version 4, Src: 192.168.1.4, Dst: 217.12.11.66
Transmission Control Protocol, Src Port: 1470 (1470), Dst Port: 587 (587), Seq: 35813, Ack: 226, Len: 1460
Simple Mail Transfer Protocol

No.     Time           Source                Destination           Protocol Length Info
     59 0.856908       192.168.1.4           217.12.11.66          SMTP     1514   C: DATA fragment, 1460 bytes

Frame 59: 1514 bytes on wire (12112 bits), 1514 bytes captured (12112 bits)
Ethernet II, Src: SonyCorp_db:60:8f (08:00:46:db:60:8f), Dst: Netgear_03:9e:c2 (00:1b:2f:03:9e:c2)
Internet Protocol Version 4, Src: 192.168.1.4, Dst: 217.12.11.66
Transmission Control Protocol, Src Port: 1470 (1470), Dst Port: 587 (587), Seq: 37273, Ack: 226, Len: 1460
Simple Mail Transfer Protocol

No.     Time           Source                Destination           Protocol Length Info
     60 0.856925       192.168.1.4           217.12.11.66          SMTP     1514   C: DATA fragment, 1460 bytes

Frame 60: 1514 bytes on wire (12112 bits), 1514 bytes captured (12112 bits)
Ethernet II, Src: SonyCorp_db:60:8f (08:00:46:db:60:8f), Dst: Netgear_03:9e:c2 (00:1b:2f:03:9e:c2)
Internet Protocol Version 4, Src: 192.168.1.4, Dst: 217.12.11.66
Transmission Control Protocol, Src Port: 1470 (1470), Dst Port: 587 (587), Seq: 38733, Ack: 226, Len: 1460
Simple Mail Transfer Protocol

No.     Time           Source                Destination           Protocol Length Info
     61 0.856942       192.168.1.4           217.12.11.66          SMTP     946    C: DATA fragment, 892 bytes

Frame 61: 946 bytes on wire (7568 bits), 946 bytes captured (7568 bits)
Ethernet II, Src: SonyCorp_db:60:8f (08:00:46:db:60:8f), Dst: Netgear_03:9e:c2 (00:1b:2f:03:9e:c2)
Internet Protocol Version 4, Src: 192.168.1.4, Dst: 217.12.11.66
Transmission Control Protocol, Src Port: 1470 (1470), Dst Port: 587 (587), Seq: 40193, Ack: 226, Len: 892
Simple Mail Transfer Protocol

No.     Time           Source                Destination           Protocol Length Info
     62 0.905395       217.12.11.66          192.168.1.4           TCP      60     587 → 1470 [ACK] Seq=226 Ack=35813 Win=64240 Len=0

Frame 62: 60 bytes on wire (480 bits), 60 bytes captured (480 bits)
Ethernet II, Src: Netgear_03:9e:c2 (00:1b:2f:03:9e:c2), Dst: SonyCorp_db:60:8f (08:00:46:db:60:8f)
Internet Protocol Version 4, Src: 217.12.11.66, Dst: 192.168.1.4
Transmission Control Protocol, Src Port: 587 (587), Dst Port: 1470 (1470), Seq: 226, Ack: 35813, Len: 0

No.     Time           Source                Destination           Protocol Length Info
     63 0.949907       217.12.11.66          192.168.1.4           TCP      60     587 → 1470 [ACK] Seq=226 Ack=38733 Win=64240 Len=0

Frame 63: 60 bytes on wire (480 bits), 60 bytes captured (480 bits)
Ethernet II, Src: Netgear_03:9e:c2 (00:1b:2f:03:9e:c2), Dst: SonyCorp_db:60:8f (08:00:46:db:60:8f)
Internet Protocol Version 4, Src: 217.12.11.66, Dst: 192.168.1.4
Transmission Control Protocol, Src Port: 587 (587), Dst Port: 1470 (1470), Seq: 226, Ack: 38733, Len: 0

No.     Time           Source                Destination           Protocol Length Info
     64 0.987478       217.12.11.66          192.168.1.4           TCP      60     587 → 1470 [ACK] Seq=226 Ack=41085 Win=64808 Len=0

Frame 64: 60 bytes on wire (480 bits), 60 bytes captured (480 bits)
Ethernet II, Src: Netgear_03:9e:c2 (00:1b:2f:03:9e:c2), Dst: SonyCorp_db:60:8f (08:00:46:db:60:8f)
Internet Protocol Version 4, Src: 217.12.11.66, Dst: 192.168.1.4
Transmission Control Protocol, Src Port: 587 (587), Dst Port: 1470 (1470), Seq: 226, Ack: 41085, Len: 0

No.     Time           Source                Destination           Protocol Length Info
     65 0.987609       192.168.1.4           217.12.11.66          SMTP     1514   C: DATA fragment, 1460 bytes

Frame 65: 1514 bytes on wire (12112 bits), 1514 bytes captured (12112 bits)
Ethernet II, Src: SonyCorp_db:60:8f (08:00:46:db:60:8f), Dst: Netgear_03:9e:c2 (00:1b:2f:03:9e:c2)
Internet Protocol Version 4, Src: 192.168.1.4, Dst: 217.12.11.66
Transmission Control Protocol, Src Port: 1470 (1470), Dst Port: 587 (587), Seq: 41085, Ack: 226, Len: 1460
Simple Mail Transfer Protocol

No.     Time           Source                Destination           Protocol Length Info
     66 0.987637       192.168.1.4           217.12.11.66          SMTP     1514   C: DATA fragment, 1460 bytes

Frame 66: 1514 bytes on wire (12112 bits), 1514 bytes captured (12112 bits)
Ethernet II, Src: SonyCorp_db:60:8f (08:00:46:db:60:8f), Dst: Netgear_03:9e:c2 (00:1b:2f:03:9e:c2)
Internet Protocol Version 4, Src: 192.168.1.4, Dst: 217.12.11.66
Transmission Control Protocol, Src Port: 1470 (1470), Dst Port: 587 (587), Seq: 42545, Ack: 226, Len: 1460
Simple Mail Transfer Protocol

No.     Time           Source                Destination           Protocol Length Info
     67 0.987654       192.168.1.4           217.12.11.66          SMTP     1107   C: DATA fragment, 1053 bytes

Frame 67: 1107 bytes on wire (8856 bits), 1107 bytes captured (8856 bits)
Ethernet II, Src: SonyCorp_db:60:8f (08:00:46:db:60:8f), Dst: Netgear_03:9e:c2 (00:1b:2f:03:9e:c2)
Internet Protocol Version 4, Src: 192.168.1.4, Dst: 217.12.11.66
Transmission Control Protocol, Src Port: 1470 (1470), Dst Port: 587 (587), Seq: 44005, Ack: 226, Len: 1053
Simple Mail Transfer Protocol

No.     Time           Source                Destination           Protocol Length Info
     68 1.033316       217.12.11.66          192.168.1.4           TCP      60     587 → 1470 [ACK] Seq=226 Ack=44005 Win=64240 Len=0

Frame 68: 60 bytes on wire (480 bits), 60 bytes captured (480 bits)
Ethernet II, Src: Netgear_03:9e:c2 (00:1b:2f:03:9e:c2), Dst: SonyCorp_db:60:8f (08:00:46:db:60:8f)
Internet Protocol Version 4, Src: 217.12.11.66, Dst: 192.168.1.4
Transmission Control Protocol, Src Port: 587 (587), Dst Port: 1470 (1470), Seq: 226, Ack: 44005, Len: 0

No.     Time           Source                Destination           Protocol Length Info
     69 1.033354       192.168.1.4           217.12.11.66          IMF      59     from: "WShark User" <xxxxxx@xxxxx.co.uk>, subject: Test message for capture,  (text/plain) (text/plain) (application/octet-stream)

Frame 69: 59 bytes on wire (472 bits), 59 bytes captured (472 bits)
Ethernet II, Src: SonyCorp_db:60:8f (08:00:46:db:60:8f), Dst: Netgear_03:9e:c2 (00:1b:2f:03:9e:c2)
Internet Protocol Version 4, Src: 192.168.1.4, Dst: 217.12.11.66
Transmission Control Protocol, Src Port: 1470 (1470), Dst Port: 587 (587), Seq: 45058, Ack: 226, Len: 5
Simple Mail Transfer Protocol
Internet Message Format

No.     Time           Source                Destination           Protocol Length Info
     70 1.052940       217.12.11.66          192.168.1.4           TCP      60     587 → 1470 [ACK] Seq=226 Ack=45063 Win=65535 Len=0

Frame 70: 60 bytes on wire (480 bits), 60 bytes captured (480 bits)
Ethernet II, Src: Netgear_03:9e:c2 (00:1b:2f:03:9e:c2), Dst: SonyCorp_db:60:8f (08:00:46:db:60:8f)
Internet Protocol Version 4, Src: 217.12.11.66, Dst: 192.168.1.4
Transmission Control Protocol, Src Port: 587 (587), Dst Port: 1470 (1470), Seq: 226, Ack: 45063, Len: 0

No.     Time           Source                Destination           Protocol Length Info
     71 1.165933       217.12.11.66          192.168.1.4           SMTP     82     S: 250 ok 1182675387 qp 77793

Frame 71: 82 bytes on wire (656 bits), 82 bytes captured (656 bits)
Ethernet II, Src: Netgear_03:9e:c2 (00:1b:2f:03:9e:c2), Dst: SonyCorp_db:60:8f (08:00:46:db:60:8f)
Internet Protocol Version 4, Src: 217.12.11.66, Dst: 192.168.1.4
Transmission Control Protocol, Src Port: 587 (587), Dst Port: 1470 (1470), Seq: 226, Ack: 45063, Len: 28
Simple Mail Transfer Protocol

No.     Time           Source                Destination           Protocol Length Info
     72 1.284928       192.168.1.4           217.12.11.66          TCP      54     1470 → 587 [ACK] Seq=45063 Ack=254 Win=65282 Len=0

Frame 72: 54 bytes on wire (432 bits), 54 bytes captured (432 bits)
Ethernet II, Src: SonyCorp_db:60:8f (08:00:46:db:60:8f), Dst: Netgear_03:9e:c2 (00:1b:2f:03:9e:c2)
Internet Protocol Version 4, Src: 192.168.1.4, Dst: 217.12.11.66
Transmission Control Protocol, Src Port: 1470 (1470), Dst Port: 587 (587), Seq: 45063, Ack: 254, Len: 0

No.     Time           Source                Destination           Protocol Length Info
     73 3.668418       192.168.1.4           217.12.11.66          SMTP     60     C: QUIT

Frame 73: 60 bytes on wire (480 bits), 60 bytes captured (480 bits)
Ethernet II, Src: SonyCorp_db:60:8f (08:00:46:db:60:8f), Dst: Netgear_03:9e:c2 (00:1b:2f:03:9e:c2)
Internet Protocol Version 4, Src: 192.168.1.4, Dst: 217.12.11.66
Transmission Control Protocol, Src Port: 1470 (1470), Dst Port: 587 (587), Seq: 45063, Ack: 254, Len: 6
Simple Mail Transfer Protocol

No.     Time           Source                Destination           Protocol Length Info
     74 3.668600       192.168.1.4           217.12.11.66          TCP      54     1470 → 587 [FIN, ACK] Seq=45069 Ack=254 Win=65282 Len=0

Frame 74: 54 bytes on wire (432 bits), 54 bytes captured (432 bits)
Ethernet II, Src: SonyCorp_db:60:8f (08:00:46:db:60:8f), Dst: Netgear_03:9e:c2 (00:1b:2f:03:9e:c2)
Internet Protocol Version 4, Src: 192.168.1.4, Dst: 217.12.11.66
Transmission Control Protocol, Src Port: 1470 (1470), Dst Port: 587 (587), Seq: 45069, Ack: 254, Len: 0

No.     Time           Source                Destination           Protocol Length Info
     75 3.685054       217.12.11.66          192.168.1.4           SMTP     86     S: 221 smtp006.mail.xxx.xxxxx.com

Frame 75: 86 bytes on wire (688 bits), 86 bytes captured (688 bits)
Ethernet II, Src: Netgear_03:9e:c2 (00:1b:2f:03:9e:c2), Dst: SonyCorp_db:60:8f (08:00:46:db:60:8f)
Internet Protocol Version 4, Src: 217.12.11.66, Dst: 192.168.1.4
Transmission Control Protocol, Src Port: 587 (587), Dst Port: 1470 (1470), Seq: 254, Ack: 45069, Len: 32
Simple Mail Transfer Protocol

No.     Time           Source                Destination           Protocol Length Info
     76 3.685103       192.168.1.4           217.12.11.66          TCP      54     1470 → 587 [RST, ACK] Seq=45070 Ack=286 Win=0 Len=0

Frame 76: 54 bytes on wire (432 bits), 54 bytes captured (432 bits)
Ethernet II, Src: SonyCorp_db:60:8f (08:00:46:db:60:8f), Dst: Netgear_03:9e:c2 (00:1b:2f:03:9e:c2)
Internet Protocol Version 4, Src: 192.168.1.4, Dst: 217.12.11.66
Transmission Control Protocol, Src Port: 1470 (1470), Dst Port: 587 (587), Seq: 45070, Ack: 286, Len: 0

No.     Time           Source                Destination           Protocol Length Info
     77 3.685264       217.12.11.66          192.168.1.4           TCP      60     587 → 1470 [FIN, ACK] Seq=286 Ack=45069 Win=65535 Len=0

Frame 77: 60 bytes on wire (480 bits), 60 bytes captured (480 bits)
Ethernet II, Src: Netgear_03:9e:c2 (00:1b:2f:03:9e:c2), Dst: SonyCorp_db:60:8f (08:00:46:db:60:8f)
Internet Protocol Version 4, Src: 217.12.11.66, Dst: 192.168.1.4
Transmission Control Protocol, Src Port: 587 (587), Dst Port: 1470 (1470), Seq: 286, Ack: 45069, Len: 0

No.     Time           Source                Destination           Protocol Length Info
     78 3.685289       192.168.1.4           217.12.11.66          TCP      54     1470 → 587 [RST] Seq=45069 Win=0 Len=0

Frame 78: 54 bytes on wire (432 bits), 54 bytes captured (432 bits)
Ethernet II, Src: SonyCorp_db:60:8f (08:00:46:db:60:8f), Dst: Netgear_03:9e:c2 (00:1b:2f:03:9e:c2)
Internet Protocol Version 4, Src: 192.168.1.4, Dst: 217.12.11.66
Transmission Control Protocol, Src Port: 1470 (1470), Dst Port: 587 (587), Seq: 45069, Len: 0
